{
  "version": "sidefx-circuit.v0.1",
  "id": "project-focus-navigation",
  "title": "Project focus and navigation semantics",
  "promise": "{\"experienceId\": \"project-focus-navigation-experience.v1\", \"actor\": \"projection-engine\", \"promise\": \"preserve focus order, navigation topology, restoration rules, and accessibility constraints declaratively\", \"observableConditions\": [{\"conditionId\": \"focus-navigation-semantics-preserved\"}]}",
  "status": "SOURCE_REVEAL",
  "sourceGeneration": "0b02db7ee691898d499cb9046737dce3f7c34aa8e1e3d6ca4908afeb823fb802",
  "sources": [
    {
      "id": "src-00000",
      "path": "data/capsule-evidence/capabilities/project-focus-navigation.json",
      "sha256": "5e05bc97d8c15c6213ced0300ddf208a67d6dc13b08d454e92fe7ec082ed17ab",
      "pointer": "",
      "kind": "DECLARED",
      "label": "Frozen capability snapshot",
      "encoding": "json"
    },
    {
      "id": "src-00001",
      "path": "data/capsule-evidence/entries/238427ed60f31418396343ba1b24506787e00c618a9d9a5c58b773c8b01eb0da-dca5b2bcc8b6feb2.json",
      "sha256": "8c65c6e967e5e4c3f610efa9c6b357b044c8e25bb1edf35897dd4fdd20dd760b",
      "pointer": "",
      "kind": "DECLARED",
      "label": "policy / consumer-execution-embodiment-plan.v1",
      "encoding": "capsule-entry"
    },
    {
      "id": "src-00002",
      "path": "data/capsule-evidence/entries/238427ed60f31418396343ba1b24506787e00c618a9d9a5c58b773c8b01eb0da-dca5b2bcc8b6feb2.json",
      "sha256": "8c65c6e967e5e4c3f610efa9c6b357b044c8e25bb1edf35897dd4fdd20dd760b",
      "pointer": "/nodes/0/operations/0",
      "kind": "DECLARED",
      "label": "operation / invoke-port",
      "encoding": "capsule-entry"
    },
    {
      "id": "src-00003",
      "path": "data/capsule-evidence/entries/238427ed60f31418396343ba1b24506787e00c618a9d9a5c58b773c8b01eb0da-dca5b2bcc8b6feb2.json",
      "sha256": "8c65c6e967e5e4c3f610efa9c6b357b044c8e25bb1edf35897dd4fdd20dd760b",
      "pointer": "/mechanicBindings/0",
      "kind": "DECLARED",
      "label": "mechanic / contract-admission",
      "encoding": "capsule-entry"
    },
    {
      "id": "src-00004",
      "path": "data/capsule-evidence/entries/238427ed60f31418396343ba1b24506787e00c618a9d9a5c58b773c8b01eb0da-dca5b2bcc8b6feb2.json",
      "sha256": "8c65c6e967e5e4c3f610efa9c6b357b044c8e25bb1edf35897dd4fdd20dd760b",
      "pointer": "/mechanicBindings/1",
      "kind": "DECLARED",
      "label": "mechanic / event-port",
      "encoding": "capsule-entry"
    },
    {
      "id": "src-00005",
      "path": "inventories/scenario-inventory.json",
      "sha256": "4e8f3aaf4382c8d52de1760596107293ba36ad9a016d55b02a06637be5730383",
      "pointer": "/527",
      "kind": "DECLARED",
      "label": "Exact narrative; verified against capsule feature bytes",
      "encoding": "json"
    },
    {
      "id": "src-00006",
      "path": "data/capsule-evidence/entries/238427ed60f31418396343ba1b24506787e00c618a9d9a5c58b773c8b01eb0da-dca5b2bcc8b6feb2.json",
      "sha256": "8c65c6e967e5e4c3f610efa9c6b357b044c8e25bb1edf35897dd4fdd20dd760b",
      "pointer": "/nodes/0/scenario",
      "kind": "DECLARED",
      "label": "Declared scenario boundary",
      "encoding": "capsule-entry"
    }
  ],
  "capabilities": [
    {
      "id": "project-focus-navigation",
      "label": "Project focus and navigation semantics",
      "domain": "Frozen source corpus",
      "scenarioIds": [
        "project-focus-navigation"
      ],
      "coverage": "1 declared scenarios; native detail remains separately inspectable",
      "sourceRefs": [
        "src-00000"
      ]
    }
  ],
  "scenarios": [
    {
      "id": "project-focus-navigation",
      "capabilityId": "project-focus-navigation",
      "label": "Preserve focus and navigation meaning for projection",
      "nodeIds": [
        "s0-input",
        "s0-event",
        "s0-outcome"
      ],
      "sourceRefs": [
        "src-00005",
        "src-00006"
      ]
    }
  ],
  "nodes": [
    {
      "id": "s0-input",
      "label": "focus navigation facts",
      "detail": "admitted focus order, navigation destinations, restoration rules, and accessibility obligations",
      "capabilityId": "project-focus-navigation",
      "scenarioId": "project-focus-navigation",
      "basis": "DECLARED",
      "sourceRefs": [
        "src-00005",
        "src-00006"
      ],
      "layer": "mechanic",
      "type": "input",
      "productContract": "project-focus-navigation-input.v1",
      "closure": null
    },
    {
      "id": "s0-event",
      "label": "focus navigation projection requested",
      "detail": "focus and navigation semantics are projected",
      "capabilityId": "project-focus-navigation",
      "scenarioId": "project-focus-navigation",
      "basis": "DECLARED",
      "sourceRefs": [
        "src-00005",
        "src-00006"
      ],
      "layer": "mechanic",
      "type": "event",
      "productContract": null,
      "closure": null
    },
    {
      "id": "s0-outcome",
      "label": "focus navigation projection known",
      "detail": "entry, sequence, groups, destinations, restoration, activation, visibility, obligations, and lineage are preserved without a target traversal decision",
      "capabilityId": "project-focus-navigation",
      "scenarioId": "project-focus-navigation",
      "basis": "DECLARED",
      "sourceRefs": [
        "src-00005",
        "src-00006"
      ],
      "layer": "mechanic",
      "type": "outcome",
      "productContract": "focus-navigation-projection-evidence.v1",
      "closure": null
    }
  ],
  "junctions": [],
  "edges": [
    {
      "id": "s0-e0",
      "source": "s0-input",
      "target": "s0-event",
      "type": "transition",
      "label": "declared boundary",
      "basis": "DECLARED",
      "sourceRefs": [
        "src-00005",
        "src-00006"
      ],
      "guard": null,
      "productContract": null,
      "maxAttempts": null,
      "exitCondition": null,
      "stopTarget": null
    },
    {
      "id": "s0-e1",
      "source": "s0-event",
      "target": "s0-outcome",
      "type": "transition",
      "label": "declared boundary",
      "basis": "DECLARED",
      "sourceRefs": [
        "src-00005",
        "src-00006"
      ],
      "guard": null,
      "productContract": null,
      "maxAttempts": null,
      "exitCondition": null,
      "stopTarget": null
    }
  ],
  "providers": [],
  "meanings": [
    {
      "nodeId": "s0-input",
      "altitude": "scenario",
      "parentId": null,
      "responsibility": null,
      "authorityId": null,
      "mechanicProfile": null,
      "experience": null,
      "variants": [],
      "productIsExperience": false
    },
    {
      "nodeId": "s0-event",
      "altitude": "scenario",
      "parentId": null,
      "responsibility": "focus and navigation semantics are projected",
      "authorityId": "focus-navigation-projection.v1",
      "mechanicProfile": null,
      "experience": null,
      "variants": [],
      "productIsExperience": false
    },
    {
      "nodeId": "s0-outcome",
      "altitude": "scenario",
      "parentId": null,
      "responsibility": null,
      "authorityId": null,
      "mechanicProfile": null,
      "experience": "entry, sequence, groups, destinations, restoration, activation, visibility, obligations, and lineage are preserved without a target traversal decision",
      "variants": [],
      "productIsExperience": false
    }
  ],
  "records": [
    {
      "id": "record-00000",
      "kind": "policy",
      "nativeType": "consumer-execution-embodiment-plan.v1",
      "sourceRef": "src-00001",
      "scenarioIds": [],
      "nativeId": null,
      "parentId": null
    },
    {
      "id": "record-00001",
      "kind": "operation",
      "nativeType": "invoke-port",
      "sourceRef": "src-00002",
      "scenarioIds": [
        "project-focus-navigation"
      ],
      "nativeId": "project-focus-navigation.operation.1",
      "parentId": null
    },
    {
      "id": "record-00002",
      "kind": "mechanic",
      "nativeType": "contract-admission",
      "sourceRef": "src-00003",
      "scenarioIds": [
        "project-focus-navigation"
      ],
      "nativeId": "contract-admission",
      "parentId": null
    },
    {
      "id": "record-00003",
      "kind": "mechanic",
      "nativeType": "event-port",
      "sourceRef": "src-00004",
      "scenarioIds": [
        "project-focus-navigation"
      ],
      "nativeId": "port:project-focus-navigation-port",
      "parentId": null
    }
  ],
  "findings": [
    {
      "code": "EDITORIAL_REVIEW_REQUIRED",
      "subject": "project-focus-navigation",
      "detail": "Source revelation preserves declarations; human storytelling and visual acceptance are separate.",
      "closure": "Review the scenario, claim scope, evidence, human experience and selected animation trace before episode use."
    },
    {
      "code": "NATIVE_MOTION_NOT_LOWERED",
      "subject": "project-focus-navigation",
      "detail": "Native records are preserved and inspectable. Scenario triads are not a simulation of the native execution graph.",
      "closure": "Admit explicit visual/trace profiles for native control flow before animating its mechanics."
    },
    {
      "code": "NO_NATIVE_CANONICAL_GRAPH",
      "subject": "project-focus-navigation",
      "detail": "Legacy plan operations and bindings are retained exactly; no full canonical graph is supplied.",
      "closure": "Use the governed blueprint projection boundary to obtain the native graph; never infer it from expressions."
    }
  ],
  "trace": []
}
