{
  "version": "sidefx-circuit.v0.1",
  "id": "verify-governed-placement",
  "title": "Verify governed placement",
  "promise": "{\"experienceId\": \"verify-governed-placement-experience.v1\", \"actor\": \"SDA maintainer\", \"promise\": \"governed placement and reference integrity evaluated\", \"observableConditions\": [{\"conditionId\": \"governed-documents-verified\"}, {\"conditionId\": \"reference-integrity-verified\"}]}",
  "status": "SOURCE_REVEAL",
  "sourceGeneration": "0b02db7ee691898d499cb9046737dce3f7c34aa8e1e3d6ca4908afeb823fb802",
  "sources": [
    {
      "id": "src-00000",
      "path": "data/capsule-evidence/capabilities/verify-governed-placement.json",
      "sha256": "46fb4fa0b3882babca9558df3b0360e648a223b868e898134ba0ad2bbc550edd",
      "pointer": "",
      "kind": "DECLARED",
      "label": "Frozen capability snapshot",
      "encoding": "json"
    },
    {
      "id": "src-00001",
      "path": "data/capsule-evidence/entries/d05f4179f0da60a197ed55784d98d13b523f5d99c8e0cae7d5aca1f87f8474eb-767ae3f6f4d8520f.json",
      "sha256": "c504b8130ce26d4cd12e5a611c7e9473f5c03a07078642d0bd9165b462acd706",
      "pointer": "",
      "kind": "DECLARED",
      "label": "policy / consumer-execution-embodiment-plan.v1",
      "encoding": "capsule-entry"
    },
    {
      "id": "src-00002",
      "path": "data/capsule-evidence/entries/d05f4179f0da60a197ed55784d98d13b523f5d99c8e0cae7d5aca1f87f8474eb-767ae3f6f4d8520f.json",
      "sha256": "c504b8130ce26d4cd12e5a611c7e9473f5c03a07078642d0bd9165b462acd706",
      "pointer": "/nodes/0/operations/0",
      "kind": "DECLARED",
      "label": "operation / invoke-port",
      "encoding": "capsule-entry"
    },
    {
      "id": "src-00003",
      "path": "data/capsule-evidence/entries/d05f4179f0da60a197ed55784d98d13b523f5d99c8e0cae7d5aca1f87f8474eb-767ae3f6f4d8520f.json",
      "sha256": "c504b8130ce26d4cd12e5a611c7e9473f5c03a07078642d0bd9165b462acd706",
      "pointer": "/mechanicBindings/0",
      "kind": "DECLARED",
      "label": "mechanic / contract-admission",
      "encoding": "capsule-entry"
    },
    {
      "id": "src-00004",
      "path": "data/capsule-evidence/entries/d05f4179f0da60a197ed55784d98d13b523f5d99c8e0cae7d5aca1f87f8474eb-767ae3f6f4d8520f.json",
      "sha256": "c504b8130ce26d4cd12e5a611c7e9473f5c03a07078642d0bd9165b462acd706",
      "pointer": "/mechanicBindings/1",
      "kind": "DECLARED",
      "label": "mechanic / event-port",
      "encoding": "capsule-entry"
    },
    {
      "id": "src-00005",
      "path": "inventories/scenario-inventory.json",
      "sha256": "4e8f3aaf4382c8d52de1760596107293ba36ad9a016d55b02a06637be5730383",
      "pointer": "/783",
      "kind": "DECLARED",
      "label": "Exact narrative; verified against capsule feature bytes",
      "encoding": "json"
    },
    {
      "id": "src-00006",
      "path": "data/capsule-evidence/entries/d05f4179f0da60a197ed55784d98d13b523f5d99c8e0cae7d5aca1f87f8474eb-767ae3f6f4d8520f.json",
      "sha256": "c504b8130ce26d4cd12e5a611c7e9473f5c03a07078642d0bd9165b462acd706",
      "pointer": "/nodes/0/scenario",
      "kind": "DECLARED",
      "label": "Declared scenario boundary",
      "encoding": "capsule-entry"
    }
  ],
  "capabilities": [
    {
      "id": "verify-governed-placement",
      "label": "Verify governed placement",
      "domain": "Frozen source corpus",
      "scenarioIds": [
        "verify-governed-placement"
      ],
      "coverage": "1 declared scenarios; native detail remains separately inspectable",
      "sourceRefs": [
        "src-00000"
      ]
    }
  ],
  "scenarios": [
    {
      "id": "verify-governed-placement",
      "capabilityId": "verify-governed-placement",
      "label": "Evaluate governed document placement and fixture-to-expectation reference integrity",
      "nodeIds": [
        "s0-input",
        "s0-event",
        "s0-outcome"
      ],
      "sourceRefs": [
        "src-00005",
        "src-00006"
      ]
    }
  ],
  "nodes": [
    {
      "id": "s0-input",
      "label": "governed placement input",
      "detail": "one workspace containing governed fixtures, expectations, and language claims",
      "capabilityId": "verify-governed-placement",
      "scenarioId": "verify-governed-placement",
      "basis": "DECLARED",
      "sourceRefs": [
        "src-00005",
        "src-00006"
      ],
      "layer": "mechanic",
      "type": "input",
      "productContract": "governed-placement-input.v1",
      "closure": null
    },
    {
      "id": "s0-event",
      "label": "governed placement verification requested",
      "detail": "governed document placement and fixture-to-expectation reference integrity are evaluated",
      "capabilityId": "verify-governed-placement",
      "scenarioId": "verify-governed-placement",
      "basis": "DECLARED",
      "sourceRefs": [
        "src-00005",
        "src-00006"
      ],
      "layer": "mechanic",
      "type": "event",
      "productContract": null,
      "closure": null
    },
    {
      "id": "s0-outcome",
      "label": "governed placement conformance known",
      "detail": "every governed document is correctly placed and paired or carries an explicit finding, and every reference either resolves or is named as broken",
      "capabilityId": "verify-governed-placement",
      "scenarioId": "verify-governed-placement",
      "basis": "DECLARED",
      "sourceRefs": [
        "src-00005",
        "src-00006"
      ],
      "layer": "mechanic",
      "type": "outcome",
      "productContract": "governed-placement-evidence.v1",
      "closure": null
    }
  ],
  "junctions": [],
  "edges": [
    {
      "id": "s0-e0",
      "source": "s0-input",
      "target": "s0-event",
      "type": "transition",
      "label": "declared boundary",
      "basis": "DECLARED",
      "sourceRefs": [
        "src-00005",
        "src-00006"
      ],
      "guard": null,
      "productContract": null,
      "maxAttempts": null,
      "exitCondition": null,
      "stopTarget": null
    },
    {
      "id": "s0-e1",
      "source": "s0-event",
      "target": "s0-outcome",
      "type": "transition",
      "label": "declared boundary",
      "basis": "DECLARED",
      "sourceRefs": [
        "src-00005",
        "src-00006"
      ],
      "guard": null,
      "productContract": null,
      "maxAttempts": null,
      "exitCondition": null,
      "stopTarget": null
    }
  ],
  "providers": [],
  "meanings": [
    {
      "nodeId": "s0-input",
      "altitude": "scenario",
      "parentId": null,
      "responsibility": null,
      "authorityId": null,
      "mechanicProfile": null,
      "experience": null,
      "variants": [],
      "productIsExperience": false
    },
    {
      "nodeId": "s0-event",
      "altitude": "scenario",
      "parentId": null,
      "responsibility": "governed document placement and fixture-to-expectation reference integrity are evaluated",
      "authorityId": "governed-placement-verification.v1",
      "mechanicProfile": null,
      "experience": null,
      "variants": [],
      "productIsExperience": false
    },
    {
      "nodeId": "s0-outcome",
      "altitude": "scenario",
      "parentId": null,
      "responsibility": null,
      "authorityId": null,
      "mechanicProfile": null,
      "experience": "every governed document is correctly placed and paired or carries an explicit finding, and every reference either resolves or is named as broken",
      "variants": [],
      "productIsExperience": false
    }
  ],
  "records": [
    {
      "id": "record-00000",
      "kind": "policy",
      "nativeType": "consumer-execution-embodiment-plan.v1",
      "sourceRef": "src-00001",
      "scenarioIds": [],
      "nativeId": null,
      "parentId": null
    },
    {
      "id": "record-00001",
      "kind": "operation",
      "nativeType": "invoke-port",
      "sourceRef": "src-00002",
      "scenarioIds": [
        "verify-governed-placement"
      ],
      "nativeId": "verify-governed-placement.operation.1",
      "parentId": null
    },
    {
      "id": "record-00002",
      "kind": "mechanic",
      "nativeType": "contract-admission",
      "sourceRef": "src-00003",
      "scenarioIds": [
        "verify-governed-placement"
      ],
      "nativeId": "contract-admission",
      "parentId": null
    },
    {
      "id": "record-00003",
      "kind": "mechanic",
      "nativeType": "event-port",
      "sourceRef": "src-00004",
      "scenarioIds": [
        "verify-governed-placement"
      ],
      "nativeId": "port:verify-governed-placement-port",
      "parentId": null
    }
  ],
  "findings": [
    {
      "code": "EDITORIAL_REVIEW_REQUIRED",
      "subject": "verify-governed-placement",
      "detail": "Source revelation preserves declarations; human storytelling and visual acceptance are separate.",
      "closure": "Review the scenario, claim scope, evidence, human experience and selected animation trace before episode use."
    },
    {
      "code": "NATIVE_MOTION_NOT_LOWERED",
      "subject": "verify-governed-placement",
      "detail": "Native records are preserved and inspectable. Scenario triads are not a simulation of the native execution graph.",
      "closure": "Admit explicit visual/trace profiles for native control flow before animating its mechanics."
    },
    {
      "code": "NO_NATIVE_CANONICAL_GRAPH",
      "subject": "verify-governed-placement",
      "detail": "Legacy plan operations and bindings are retained exactly; no full canonical graph is supplied.",
      "closure": "Use the governed blueprint projection boundary to obtain the native graph; never infer it from expressions."
    }
  ],
  "trace": []
}
