{
  "version": "sidefx-circuit.v0.1",
  "id": "project-adaptation-binding",
  "title": "Project semantic adaptation",
  "promise": "{\"experienceId\": \"adaptation-binding-projection-experience.v1\", \"actor\": \"semantic-projection-engineer\", \"promise\": \"declared adaptation binding facts are projected deterministically with all invariant rules preserved\", \"observableConditions\": [{\"conditionId\": \"adaptation-contexts-preserved\"}, {\"conditionId\": \"composition-and-invariants-preserved\"}, {\"conditionId\": \"lineage-preserved\"}]}",
  "status": "SOURCE_REVEAL",
  "sourceGeneration": "0b02db7ee691898d499cb9046737dce3f7c34aa8e1e3d6ca4908afeb823fb802",
  "sources": [
    {
      "id": "src-00000",
      "path": "data/capsule-evidence/capabilities/project-adaptation-binding.json",
      "sha256": "e7214c6a34af40d17bec637388590e70e7c0b6acb6e37b54835a0f6b92f22049",
      "pointer": "",
      "kind": "DECLARED",
      "label": "Frozen capability snapshot",
      "encoding": "json"
    },
    {
      "id": "src-00001",
      "path": "data/capsule-evidence/entries/fcff768a65381d11e367f06f98b95580be1f440c7eddd2d55975e34a16a9ef47-f265c22cced0e1d4.json",
      "sha256": "2344dae9a6e9b719f3a6eefb96597049c14b433f7cfb393fecfb0c2c0c391813",
      "pointer": "",
      "kind": "DECLARED",
      "label": "policy / consumer-execution-embodiment-plan.v1",
      "encoding": "capsule-entry"
    },
    {
      "id": "src-00002",
      "path": "data/capsule-evidence/entries/fcff768a65381d11e367f06f98b95580be1f440c7eddd2d55975e34a16a9ef47-f265c22cced0e1d4.json",
      "sha256": "2344dae9a6e9b719f3a6eefb96597049c14b433f7cfb393fecfb0c2c0c391813",
      "pointer": "/nodes/0/operations/0",
      "kind": "DECLARED",
      "label": "operation / invoke-port",
      "encoding": "capsule-entry"
    },
    {
      "id": "src-00003",
      "path": "data/capsule-evidence/entries/fcff768a65381d11e367f06f98b95580be1f440c7eddd2d55975e34a16a9ef47-f265c22cced0e1d4.json",
      "sha256": "2344dae9a6e9b719f3a6eefb96597049c14b433f7cfb393fecfb0c2c0c391813",
      "pointer": "/mechanicBindings/0",
      "kind": "DECLARED",
      "label": "mechanic / contract-admission",
      "encoding": "capsule-entry"
    },
    {
      "id": "src-00004",
      "path": "data/capsule-evidence/entries/fcff768a65381d11e367f06f98b95580be1f440c7eddd2d55975e34a16a9ef47-f265c22cced0e1d4.json",
      "sha256": "2344dae9a6e9b719f3a6eefb96597049c14b433f7cfb393fecfb0c2c0c391813",
      "pointer": "/mechanicBindings/1",
      "kind": "DECLARED",
      "label": "mechanic / event-port",
      "encoding": "capsule-entry"
    },
    {
      "id": "src-00005",
      "path": "inventories/scenario-inventory.json",
      "sha256": "4e8f3aaf4382c8d52de1760596107293ba36ad9a016d55b02a06637be5730383",
      "pointer": "/495",
      "kind": "DECLARED",
      "label": "Exact narrative; verified against capsule feature bytes",
      "encoding": "json"
    },
    {
      "id": "src-00006",
      "path": "data/capsule-evidence/entries/fcff768a65381d11e367f06f98b95580be1f440c7eddd2d55975e34a16a9ef47-f265c22cced0e1d4.json",
      "sha256": "2344dae9a6e9b719f3a6eefb96597049c14b433f7cfb393fecfb0c2c0c391813",
      "pointer": "/nodes/0/scenario",
      "kind": "DECLARED",
      "label": "Declared scenario boundary",
      "encoding": "capsule-entry"
    }
  ],
  "capabilities": [
    {
      "id": "project-adaptation-binding",
      "label": "Project semantic adaptation",
      "domain": "Frozen source corpus",
      "scenarioIds": [
        "project-adaptation-binding"
      ],
      "coverage": "1 declared scenarios; native detail remains separately inspectable",
      "sourceRefs": [
        "src-00000"
      ]
    }
  ],
  "scenarios": [
    {
      "id": "project-adaptation-binding",
      "capabilityId": "project-adaptation-binding",
      "label": "Preserve declared adaptation rules for projection",
      "nodeIds": [
        "s0-input",
        "s0-event",
        "s0-outcome"
      ],
      "sourceRefs": [
        "src-00005",
        "src-00006"
      ]
    }
  ],
  "nodes": [
    {
      "id": "s0-input",
      "label": "adaptation binding facts",
      "detail": "admitted adaptation contexts, operations, priorities, and invariants",
      "capabilityId": "project-adaptation-binding",
      "scenarioId": "project-adaptation-binding",
      "basis": "DECLARED",
      "sourceRefs": [
        "src-00005",
        "src-00006"
      ],
      "layer": "mechanic",
      "type": "input",
      "productContract": "project-adaptation-binding-input.v1",
      "closure": null
    },
    {
      "id": "s0-event",
      "label": "adaptation binding projection requested",
      "detail": "semantic adaptation is projected",
      "capabilityId": "project-adaptation-binding",
      "scenarioId": "project-adaptation-binding",
      "basis": "DECLARED",
      "sourceRefs": [
        "src-00005",
        "src-00006"
      ],
      "layer": "mechanic",
      "type": "event",
      "productContract": null,
      "closure": null
    },
    {
      "id": "s0-outcome",
      "label": "adaptation binding projection known",
      "detail": "predicates, grouping, order, visibility, composition, invariants, priority, and lineage are preserved without a target layout decision",
      "capabilityId": "project-adaptation-binding",
      "scenarioId": "project-adaptation-binding",
      "basis": "DECLARED",
      "sourceRefs": [
        "src-00005",
        "src-00006"
      ],
      "layer": "mechanic",
      "type": "outcome",
      "productContract": "adaptation-binding-projection-evidence.v1",
      "closure": null
    }
  ],
  "junctions": [],
  "edges": [
    {
      "id": "s0-e0",
      "source": "s0-input",
      "target": "s0-event",
      "type": "transition",
      "label": "declared boundary",
      "basis": "DECLARED",
      "sourceRefs": [
        "src-00005",
        "src-00006"
      ],
      "guard": null,
      "productContract": null,
      "maxAttempts": null,
      "exitCondition": null,
      "stopTarget": null
    },
    {
      "id": "s0-e1",
      "source": "s0-event",
      "target": "s0-outcome",
      "type": "transition",
      "label": "declared boundary",
      "basis": "DECLARED",
      "sourceRefs": [
        "src-00005",
        "src-00006"
      ],
      "guard": null,
      "productContract": null,
      "maxAttempts": null,
      "exitCondition": null,
      "stopTarget": null
    }
  ],
  "providers": [],
  "meanings": [
    {
      "nodeId": "s0-input",
      "altitude": "scenario",
      "parentId": null,
      "responsibility": null,
      "authorityId": null,
      "mechanicProfile": null,
      "experience": null,
      "variants": [],
      "productIsExperience": false
    },
    {
      "nodeId": "s0-event",
      "altitude": "scenario",
      "parentId": null,
      "responsibility": "semantic adaptation is projected",
      "authorityId": "adaptation-binding-projection.v1",
      "mechanicProfile": null,
      "experience": null,
      "variants": [],
      "productIsExperience": false
    },
    {
      "nodeId": "s0-outcome",
      "altitude": "scenario",
      "parentId": null,
      "responsibility": null,
      "authorityId": null,
      "mechanicProfile": null,
      "experience": "predicates, grouping, order, visibility, composition, invariants, priority, and lineage are preserved without a target layout decision",
      "variants": [],
      "productIsExperience": false
    }
  ],
  "records": [
    {
      "id": "record-00000",
      "kind": "policy",
      "nativeType": "consumer-execution-embodiment-plan.v1",
      "sourceRef": "src-00001",
      "scenarioIds": [],
      "nativeId": null,
      "parentId": null
    },
    {
      "id": "record-00001",
      "kind": "operation",
      "nativeType": "invoke-port",
      "sourceRef": "src-00002",
      "scenarioIds": [
        "project-adaptation-binding"
      ],
      "nativeId": "project-adaptation-binding.operation.1",
      "parentId": null
    },
    {
      "id": "record-00002",
      "kind": "mechanic",
      "nativeType": "contract-admission",
      "sourceRef": "src-00003",
      "scenarioIds": [
        "project-adaptation-binding"
      ],
      "nativeId": "contract-admission",
      "parentId": null
    },
    {
      "id": "record-00003",
      "kind": "mechanic",
      "nativeType": "event-port",
      "sourceRef": "src-00004",
      "scenarioIds": [
        "project-adaptation-binding"
      ],
      "nativeId": "port:adaptation-projection-port",
      "parentId": null
    }
  ],
  "findings": [
    {
      "code": "EDITORIAL_REVIEW_REQUIRED",
      "subject": "project-adaptation-binding",
      "detail": "Source revelation preserves declarations; human storytelling and visual acceptance are separate.",
      "closure": "Review the scenario, claim scope, evidence, human experience and selected animation trace before episode use."
    },
    {
      "code": "NATIVE_MOTION_NOT_LOWERED",
      "subject": "project-adaptation-binding",
      "detail": "Native records are preserved and inspectable. Scenario triads are not a simulation of the native execution graph.",
      "closure": "Admit explicit visual/trace profiles for native control flow before animating its mechanics."
    },
    {
      "code": "NO_NATIVE_CANONICAL_GRAPH",
      "subject": "project-adaptation-binding",
      "detail": "Legacy plan operations and bindings are retained exactly; no full canonical graph is supplied.",
      "closure": "Use the governed blueprint projection boundary to obtain the native graph; never infer it from expressions."
    }
  ],
  "trace": []
}
